{
  "schemaVersion": 1,
  "evidenceId": "TPMQ-20260801-fw-only-crb-001",
  "sourceCommit": "b9c317d35b85aa082904ecd40c4a54c81aded99a",
  "sourceArchiveDigest": "29e54aaf9dd1ecc60e263fed3e6e06226115b76033b3965bdcd062441bcc2f30",
  "installationArtifactDigest": "0b7dd90d86f11c713246a0fd36e63b5d7dddcccad45de710239e5add28fab217",
  "qemuDigest": "27cd395848940fc6482256d85096fc64bc4fe3f3e909824d51c202f8314cd9e9",
  "qemuVersion": "QEMU emulator version 10.2.2 (qemu-10.2.2-1.fc44)",
  "ovmfCodeDigest": "6551948da24a02553476c1c1edccb0bb92a57dce9d722d7b396ac14547e6d9af",
  "ovmfVarsTemplateDigest": "035317bb2923a13c1dc57373d608521cc3a486f1e3119016727d54baccc6e8bb",
  "swtpmDigest": "32c411b8d1b269ca6b5ae922e84459dec5669dc96ca17bb5cf8119f830ab7ce0",
  "swtpmVersion": "0.10.1",
  "libtpmsVersion": "0.10.2",
  "scenarioVersion": "tpmq-1",
  "environment": "qemu-kvm",
  "acceleration": "kvm",
  "machineType": "pc-q35-10.2",
  "cpuModel": "host",
  "diagnostic": false,
  "diskAttached": false,
  "ovmfVarsState": "fresh",
  "ovmfVarsSourceDigest": "035317bb2923a13c1dc57373d608521cc3a486f1e3119016727d54baccc6e8bb",
  "ovmfVarsAfterDigest": "be4baef05394881527e5985e2c7b5aa6acfe9d0736eb4c90fa549138255f4c18",
  "tpmInterface": "crb",
  "tpmState": "fresh",
  "secureBootState": "disabled",
  "smmState": "off",
  "bootType": "cold",
  "onReset": "stop",
  "expectedResets": 0,
  "guestResetCount": 0,
  "stagesReached": [],
  "lastStage": "none",
  "secondBootTargetReached": null,
  "resetClassification": "HOST_TERMINATED",
  "classificationBasis": [
    "SHUTDOWN event: {\"guest\": false, \"reason\": \"host-qmp-quit\"}",
    "QEMU process exited without a guest reset event; stderr: ''"
  ],
  "result": "INCONCLUSIVE",
  "startedAt": "2026-08-01T20:29:30.728Z",
  "completedAt": "2026-08-01T20:32:31.208Z",
  "operator": "allamsettiraviteja2009",
  "limitations": [],
  "evidenceFiles": [
    {
      "path": "host-dmesg-tail.log",
      "sha256": "ba29b7e3ea6a09dd8c736b6e33b28225536fdb566b7a9ebe46bb79213fa41863",
      "sizeBytes": 9596,
      "createdAt": "2026-08-01T20:32:31.208Z",
      "collectionCommand": "run_tpm_experiment.py",
      "retentionClass": "evidence"
    },
    {
      "path": "qemu-command.json",
      "sha256": "b8a7cea52dc4d2a24d0b7e4c7d3d9fa33932181b562a16b370a3fae928b11a4c",
      "sizeBytes": 1977,
      "createdAt": "2026-08-01T20:32:31.208Z",
      "collectionCommand": "run_tpm_experiment.py",
      "retentionClass": "evidence"
    },
    {
      "path": "qemu-debug.log",
      "sha256": "a32e8781e7a9a324e9d373e2d685521d665380b23ee339b707abd9330da16290",
      "sizeBytes": 10800,
      "createdAt": "2026-08-01T20:32:31.208Z",
      "collectionCommand": "run_tpm_experiment.py",
      "retentionClass": "evidence"
    },
    {
      "path": "qmp-events.jsonl",
      "sha256": "a48fc7812f3fed50daee7601fd6a579c828b20d747e7d3b4451de5fc26a08bbe",
      "sizeBytes": 570,
      "createdAt": "2026-08-01T20:32:31.208Z",
      "collectionCommand": "run_tpm_experiment.py",
      "retentionClass": "evidence"
    },
    {
      "path": "screenshots/final.ppm",
      "sha256": "bf13a79c7e45f70ca3b29541fb87fe8e7369cafcb3092b9deb37b72eec7c2b6f",
      "sizeBytes": 3072016,
      "createdAt": "2026-08-01T20:32:31.208Z",
      "collectionCommand": "run_tpm_experiment.py",
      "retentionClass": "evidence"
    },
    {
      "path": "serial.log",
      "sha256": "de6b3623e41af1bc92cd73cbe6649d9619574effb3f9181f003ba5a703596d43",
      "sizeBytes": 720,
      "createdAt": "2026-08-01T20:32:31.208Z",
      "collectionCommand": "run_tpm_experiment.py",
      "retentionClass": "evidence"
    },
    {
      "path": "swtpm-stderr.log",
      "sha256": "e3b0c44298fc1c149afbf4c8996fb92427ae41e4649b934ca495991b7852b855",
      "sizeBytes": 0,
      "createdAt": "2026-08-01T20:32:31.208Z",
      "collectionCommand": "run_tpm_experiment.py",
      "retentionClass": "evidence"
    },
    {
      "path": "swtpm-stdout.log",
      "sha256": "e3b0c44298fc1c149afbf4c8996fb92427ae41e4649b934ca495991b7852b855",
      "sizeBytes": 0,
      "createdAt": "2026-08-01T20:32:31.208Z",
      "collectionCommand": "run_tpm_experiment.py",
      "retentionClass": "evidence"
    },
    {
      "path": "swtpm.log",
      "sha256": "a37842e2005ea62ffc6c02e76258f55b9db1d5c13096ff5b2bf496fccea5702e",
      "sizeBytes": 86683,
      "createdAt": "2026-08-01T20:32:31.208Z",
      "collectionCommand": "run_tpm_experiment.py",
      "retentionClass": "evidence"
    },
    {
      "path": "work-manifest.json",
      "sha256": "09b555c73a3ac421cdc7de3f6c36a30de7872c7f4d5728661e0297619714e330",
      "sizeBytes": 515,
      "createdAt": "2026-08-01T20:32:31.208Z",
      "collectionCommand": "run_tpm_experiment.py",
      "retentionClass": "evidence"
    }
  ]
}
